id,email,name,website,amenity,building,shop,tourism,information,addr:full,tags_search,additional_information,geometry,sentence,gml_id,interpreted_type,mid_labels,bosserhof_class,short_reason
4807469954,,WasserErlebnisWeg Bad Harzburg,,,,,information,board,,board type nature check date 2025 08 17,,POINT (10.561176300048828 51.87343978881836),WasserErlebnisWeg Bad Harzburg. Tourism: information; Information: board. Additional tags: board type nature check date 2025 08 17.,4807469954,WasserErlebnisWeg (outdoor water‐experience trail with information boards),[],,This feature is an outdoor nature trail (‘Erlebnisweg’) with information boards (OSM tags: tourism=i
1951182227,,Ölpumpe,,,,,artwork,,,historic memorial,,POINT (10.093619346618652 52.48878860473633),Ölpumpe. Tourism: artwork. Additional tags: historic memorial.,1951182227,Outdoor artwork (oil pump sculpture / historic memorial),[],,The OSM tags tourism=artwork and historic memorial indicate this is an outdoor sculpture or memorial
383255019,,,,parking,,,,,,access private,,"POLYGON ((10.130395889282227 52.359195709228516, 10.12899398803711 52.3592529296875, 10.128824234008789 52.359214782714844, 10.128695487976074 52.359130859375, 10.128682136535645 52.359073638916016, 10.129602432250977 52.358497619628906, 10.130577087402344 52.359066009521484, 10.130395889282227 52.359195709228516))",Amenity: parking. Additional tags: access private.,383255019,Private parking area,[],,"The OSM tags amenity=parking and access=private describe an outdoor parking lot, which is infrastruc"
386623247,,,,bench,,,,,,,,POINT (10.485942840576172 52.048988342285156),Amenity: bench.,386623247,bench,[],,"The OSM tag amenity=bench denotes a public seating fixture in the open, not an enterable building or"
1451367400,,,,parking_space,,,,,,,,"POLYGON ((10.263174057006836 51.72725296020508, 10.263163566589355 51.72720718383789, 10.263201713562012 51.727203369140625, 10.263212203979492 51.72724914550781, 10.263174057006836 51.72725296020508))",Amenity: parking_space.,1451367400,Parking space,[],,"The OSM tag amenity=parking_space denotes an outdoor parking area, not an enterable building or faci"
2152387680,,,,waste_basket,,,,,,,,POINT (10.704201698303223 52.39126205444336),Amenity: waste_basket.,2152387680,Waste basket,[],,"The feature is a waste basket (amenity=waste_basket), which is an outdoor object and not an enterabl"
3240680283,,Hörgeräte B. Kress,,,,hearing_aids,,,"Eichstraße, 5, Ilsede, 31241",addr suburb groß ilsede contact phone 49 5172 598 9673 contact website http hoergeraete kress de,,POINT (10.218005180358887 52.26396179199219),"Hörgeräte B. Kress. Shop: hearing_aids. Address: Eichstraße, 5, Ilsede, 31241. Additional tags: addr suburb groß ilsede contact phone 49 5172 598 9673 contact website http hoergeraete kress de.",3240680283,Hearing aid shop,"['retail_non_daily', 'work']",Handel,"The place is an enterable retail outlet (‘Shop: hearing_aids’) selling and fitting hearing aids.  
F"
5964806124,,,,hunting_stand,,,,,,,,POINT (10.615174293518066 52.237396240234375),Amenity: hunting_stand.,5964806124,hunting stand,[],,"The OSM tag amenity=hunting_stand denotes an outdoor hunting platform or hide, not an enterable buil"
31770742,,Penny,,,supermarket,supermarket,,,"Celler Heerstraße, 312, Braunschweig, 38112",addr suburb watenbüttel brand penny brand wikidata q284688 wheelchair yes,,"POLYGON ((10.466753005981445 52.30458450317383, 10.466812133789062 52.30461883544922, 10.466761589050293 52.30465316772461, 10.467222213745117 52.30489730834961, 10.467257499694824 52.304874420166016, 10.46741008758545 52.30494689941406, 10.467076301574707 52.3050422668457, 10.467035293579102 52.30501937866211, 10.466955184936523 52.3050651550293, 10.46678352355957 52.30496597290039, 10.466739654541016 52.30499267578125, 10.466415405273438 52.3048095703125, 10.466753005981445 52.30458450317383))","Penny. Building: supermarket; Shop: supermarket. Address: Celler Heerstraße, 312, Braunschweig, 38112. Additional tags: addr suburb watenbüttel brand penny brand wikidata q284688 wheelchair yes.",31770742,Penny supermarket (discount grocery store),"['errands_essential', 'work']",Einzelhandel_kleinflaechig_Discountmaerkte,"This is a Penny supermarket (OSM: building=supermarket, shop=supermarket, brand=Penny), an enterable"
2311673695,,EDEKA Peter,,,,supermarket,,,"Dannenbütteler Weg, 1, Sassenburg, 38524",addr suburb westerbeck contact phone 49 5371 618245 wheelchair yes,lottery: yes,POINT (10.629524230957031 52.50935363769531),"EDEKA Peter. Shop: supermarket. Address: Dannenbütteler Weg, 1, Sassenburg, 38524. Additional tags: addr suburb westerbeck contact phone 49 5371 618245 wheelchair yes.",2311673695,EDEKA supermarket,"['errands_essential', 'work']",Einzelhandel_grossflaechig_Verbrauchermaerkte,"The POI is tagged shop=supermarket and named “EDEKA Peter,” indicating a customer‐facing retail groc"
411826646,,,,,,,information,guidepost,,,,POINT (10.264852523803711 51.85647964477539),Tourism: information; Information: guidepost.,411826646,Guidepost (tourist information sign),[],,The OSM tags tourism=information and information=guidepost indicate this is a guidepost or signage f
89753945,,,,public_building,yes,,,,"Stiftsfreiheit, 4, Bad Gandersheim, 37581",,,"POLYGON ((10.027082443237305 51.870243072509766, 10.027094841003418 51.870174407958984, 10.027286529541016 51.87019729614258, 10.027276039123535 51.87021255493164, 10.027351379394531 51.870235443115234, 10.027435302734375 51.87025833129883, 10.027497291564941 51.870208740234375, 10.027385711669922 51.870174407958984, 10.027376174926758 51.87017059326172, 10.02738094329834 51.87013626098633, 10.027108192443848 51.87010192871094, 10.02711009979248 51.87008285522461, 10.026934623718262 51.87006759643555, 10.026897430419922 51.87023162841797, 10.027082443237305 51.870243072509766))","Amenity: public_building; Building: yes. Address: Stiftsfreiheit, 4, Bad Gandersheim, 37581.",89753945,public administration building (öffentlicher Dienstleistungsbau),"['errands_essential', 'work']",Publikumsorientierte_Dienstleistungen,The OSM tags amenity=public_building and building=yes without more detail indicate a municipal or pu
7770956057,,,,,,,information,board,,,,POINT (10.535491943359375 52.485687255859375),Tourism: information; Information: board.,7770956057,Tourism information board,[],,The OSM tags tourism=information and information=board indicate an outdoor tourist information sign 
304048164,,,,parking,,,,,,,,"POLYGON ((10.960707664489746 52.13376235961914, 10.960372924804688 52.133731842041016, 10.960338592529297 52.13377380371094, 10.960343360900879 52.13383483886719, 10.960295677185059 52.133872985839844, 10.960254669189453 52.13392639160156, 10.960026741027832 52.13396453857422, 10.960037231445312 52.134063720703125, 10.960049629211426 52.13417434692383, 10.960173606872559 52.13419723510742, 10.960663795471191 52.1341667175293, 10.960707664489746 52.13376235961914))",Amenity: parking.,304048164,parking lot,[],,"The OSM tag amenity=parking refers to an open-air parking facility, which is outdoor transport infra"
3297577108,,,,hunting_stand,,,,,,height 1 5 hide no lockable no shelter no,,POINT (10.482584953308105 52.44901657104492),Amenity: hunting_stand. Additional tags: height 1 5 hide no lockable no shelter no.,3297577108,hunting stand,[],,The feature is tagged as amenity=hunting_stand with no shelter or lockable enclosure and is typicall
569112192,,,,parking_space,,,,,,capacity 19,,"POLYGON ((10.556038856506348 52.15829849243164, 10.556258201599121 52.15834045410156, 10.556355476379395 52.15814208984375, 10.556245803833008 52.15812301635742, 10.556136131286621 52.158103942871094, 10.556038856506348 52.15829849243164))",Amenity: parking_space. Additional tags: capacity 19.,569112192,Parking space,[],,"The OSM tag amenity=parking_space with capacity=19 describes an outdoor parking facility, not an ent"
189150036,,St. Alexander,,place_of_worship,yes,,attraction,,Am Kirchberg,denomination lutheran wikidata q106729130,religion: christian,"POLYGON ((10.109387397766113 51.781402587890625, 10.108978271484375 51.78141784667969, 10.108976364135742 51.78138732910156, 10.10887622833252 51.78138732910156, 10.10887336730957 51.781349182128906, 10.108870506286621 51.78131866455078, 10.108960151672363 51.781314849853516, 10.108957290649414 51.78127670288086, 10.109101295471191 51.78126907348633, 10.109370231628418 51.7812614440918, 10.109373092651367 51.78129196166992, 10.109419822692871 51.781288146972656, 10.10942554473877 51.78135681152344, 10.109384536743164 51.7813606262207, 10.109387397766113 51.781402587890625))",St. Alexander. Amenity: place_of_worship; Building: yes; Tourism: attraction. Address: Am Kirchberg. Additional tags: denomination lutheran wikidata q106729130.,189150036,Lutheran church,['leisure'],,"The OSM tags amenity=place_of_worship, building=yes and tourism=attraction together indicate this is"
1017574043,,,,parking,,,,,,,,"POLYGON ((10.314963340759277 52.14453125, 10.314521789550781 52.14442443847656, 10.314488410949707 52.14438247680664, 10.314702987670898 52.14411544799805, 10.315217971801758 52.14432144165039, 10.315129280090332 52.1444091796875, 10.315046310424805 52.14455032348633, 10.314963340759277 52.14453125))",Amenity: parking.,1017574043,parking area,[],,"The OSM tag amenity=parking denotes an outdoor parking facility, which is transport infrastructure r"
2317573185,,,,,,,information,guidepost,,hiking yes,,POINT (10.299072265625 51.91168212890625),Tourism: information; Information: guidepost. Additional tags: hiking yes.,2317573185,Hiking guidepost (tourism information),[],,The OSM tags tourism=information and information=guidepost with hiking=yes indicate this is an outdo
254914403,,Seniorenresidenz am Badepark,,social_facility,residential,,,,"Schmiedestraße, 9, Bad Harzburg, 38667",fax 49 5322 55083 roof levels 1 roof shape gabled social facility for senior,social_facility: nursing_home,"POLYGON ((10.562381744384766 51.87977981567383, 10.562628746032715 51.87980651855469, 10.56265926361084 51.879703521728516, 10.56258773803711 51.879695892333984, 10.562601089477539 51.8796501159668, 10.562644958496094 51.87965393066406, 10.562663078308105 51.87959289550781, 10.562478065490723 51.879573822021484, 10.562460899353027 51.87963104248047, 10.562503814697266 51.879634857177734, 10.562488555908203 51.87968444824219, 10.56241226196289 51.879676818847656, 10.562381744384766 51.87977981567383))","Seniorenresidenz am Badepark. Amenity: social_facility; Building: residential. Address: Schmiedestraße, 9, Bad Harzburg, 38667. Additional tags: fax 49 5322 55083 roof levels 1 roof shape gabled social facility for senior.",254914403,Seniorenresidenz (Altenheim),"['leisure', 'work']",Altenheime,The POI is named “Seniorenresidenz am Badepark” with OSM tags amenity=social_facility and building=r
7627633152,,,,bench,,,,,,material wood,,POINT (10.520597457885742 51.90860366821289),Amenity: bench. Additional tags: material wood.,7627633152,wooden bench,[],,"The OSM tags indicate amenity=bench and material=wood, which describes an outdoor seating object. Th"
1683899177,,,,bench,,,,,,,,POINT (10.055877685546875 52.60833740234375),Amenity: bench.,1683899177,public bench,[],,"The feature is a bench (amenity=bench), which is an outdoor seating object rather than an enterable "
1386132030,,,,parking,,,,,,orientation parallel,parking: street_side,"POLYGON ((10.50210952758789 52.260738372802734, 10.502106666564941 52.26072311401367, 10.502409934997559 52.26068878173828, 10.50241470336914 52.260704040527344, 10.50210952758789 52.260738372802734))",Amenity: parking. Additional tags: orientation parallel.,1386132030,parking area (amenity=parking),[],,"The OSM tag amenity=parking denotes an outdoor parking facility, not an enterable building or struct"
150631587,,,,parking,,,,,,,,"POLYGON ((10.746414184570312 52.398468017578125, 10.746438026428223 52.397926330566406, 10.74698257446289 52.39793395996094, 10.746959686279297 52.398475646972656, 10.746414184570312 52.398468017578125))",Amenity: parking.,150631587,parking,[],,"The OSM tag amenity=parking denotes an outdoor parking area, which is infrastructure rather than an "
1768294627,,,,,,,picnic_site,,,,,POINT (10.609225273132324 52.184139251708984),Tourism: picnic_site.,1768294627,Picnic site,[],,"The OSM tag tourism=picnic_site indicates an outdoor picnic area (benches, tables) rather than an en"
235841355,,,,,bungalow,,chalet,,,,,"POLYGON ((10.360469818115234 51.81099319458008, 10.360431671142578 51.81097412109375, 10.360387802124023 51.81095504760742, 10.360288619995117 51.811031341552734, 10.360369682312012 51.811073303222656, 10.360469818115234 51.81099319458008))",Building: bungalow; Tourism: chalet.,235841355,Tourist chalet / holiday bungalow,"['leisure', 'work']",Hotels,The OSM tags ‘building=bungalow’ combined with ‘tourism=chalet’ indicate a small tourist lodging use
1126032713,,,,parking,,,,,,,,"POLYGON ((10.84696102142334 52.43117141723633, 10.846956253051758 52.431121826171875, 10.847054481506348 52.43105697631836, 10.847053527832031 52.43100357055664, 10.847355842590332 52.43100357055664, 10.847352027893066 52.431156158447266, 10.847074508666992 52.431156158447266, 10.847074508666992 52.43117141723633, 10.84696102142334 52.43117141723633))",Amenity: parking.,1126032713,parking area,[],,"The OSM tag amenity=parking denotes an outdoor parking facility, not an enterable building or struct"
268979832,,Little Pizzaland,,fast_food,,,,,"Karl-Marx-Straße, 13, Braunschweig, 38104",cuisine pizza diet vegan no diet vegetarian yes indoor seating no outdoor seating no takeaway only wheelchair no,,POINT (10.546475410461426 52.26742172241211),"Little Pizzaland. Amenity: fast_food. Address: Karl-Marx-Straße, 13, Braunschweig, 38104. Additional tags: cuisine pizza diet vegan no diet vegetarian yes indoor seating no outdoor seating no takeaway only wheelchair no.",268979832,Fast-food pizza takeaway restaurant,"['leisure', 'work']",Restaurants_Gastronomie,OSM tags amenity=fast_food and cuisine=pizza identify Little Pizzaland as a fast-food take-away pizz
8851170695,,,,recycling,,,,,,recycling clothes yes recycling glass bottles yes recycling paper yes recycling type container,,POINT (10.364567756652832 52.26768112182617),Amenity: recycling. Additional tags: recycling clothes yes recycling glass bottles yes recycling paper yes recycling type container.,8851170695,Recycling container,[],,The POI is tagged amenity=recycling with recycling:type=container and various recyclable materials. 
12504948701,,Autowelt Salzgitter,,,,car,,,,,,POINT (10.352250099182129 52.157859802246094),Autowelt Salzgitter. Shop: car.,12504948701,Car dealership (Autowelt Salzgitter),"['retail_non_daily', 'work']",Autohaeuser,The OSM tag shop=car indicates an automobile sales building. Trips to purchase a car are non‐daily r
1385851334,,,,waste_basket,,,,,,,,POINT (10.802523612976074 52.14033889770508),Amenity: waste_basket.,1385851334,Public waste bin,[],,"The OSM tag amenity=waste_basket denotes a standalone public trash receptacle (street furniture), no"
725044972,,Frischmarkt Peisker,,,,supermarket,,,,,,POINT (10.036675453186035 52.771358489990234),Frischmarkt Peisker. Shop: supermarket.,725044972,supermarket,"['errands_essential', 'work']",Einzelhandel_grossflaechig_Verbrauchermaerkte,The OSM tag shop=supermarket and the name “Frischmarkt” clearly identify this as a grocery retail bu
10200629441,,,,recycling,,,,,,check date recycling 2025 03 16 recycling green waste yes recycling type container,,POINT (10.572665214538574 52.25593948364258),Amenity: recycling. Additional tags: check date recycling 2025 03 16 recycling green waste yes recycling type container.,10200629441,Outdoor recycling container (green waste),[],[],The OSM tags indicate amenity=recycling with recycling:type=container and green waste collection. Th
403461087,,,,parking_space,,,,,,,,"POLYGON ((10.538320541381836 52.462039947509766, 10.538284301757812 52.462032318115234, 10.538268089294434 52.46207809448242, 10.538304328918457 52.46208190917969, 10.538320541381836 52.462039947509766))",Amenity: parking_space.,403461087,Parking space,[],,The OSM tag amenity=parking_space denotes an individual parking spot—a piece of outdoor infrastructu
3138087776,,Kräcker's Kitchen,,restaurant,,,,,"Hannoversche Straße, 60d, Braunschweig, 38116",contact email info kräckers braunschweig de contact phone 4953159016211 contact website https www kraeckers braunschweig de cuisine american diet vegetarian yes level 0 lunch menu url https www kraeckers braunschweig de menu html outdoor seating yes reservation yes toilets wheelchair yes wheelchair yes,,POINT (10.494102478027344 52.27323913574219),"Kräcker's Kitchen. Amenity: restaurant. Address: Hannoversche Straße, 60d, Braunschweig, 38116. Additional tags: contact email info kräckers braunschweig de contact phone 4953159016211 contact website https www kraeckers braunschweig de cuisine american diet vegetarian yes level 0 lunch menu url https www kraeckers braunschweig de menu html outdoor seating yes reservation yes toilets wheelchair yes wheelchair yes.",3138087776,Full-service restaurant offering American cuisine with vegetarian options and outdoor seating,"['leisure', 'work']",Restaurants_Gastronomie,The OSM tag amenity=restaurant and the name “Kräcker’s Kitchen” indicate an enterable building opera
385975237,,Almke,,shelter,,,,,,bus yes highway bus stop network vrb public transport platform shelter type public transport,,"POLYGON ((10.854632377624512 52.343074798583984, 10.854697227478027 52.343074798583984, 10.854697227478027 52.34304428100586, 10.854632377624512 52.34304428100586, 10.854632377624512 52.343074798583984))",Almke. Amenity: shelter. Additional tags: bus yes highway bus stop network vrb public transport platform shelter type public transport.,385975237,bus stop shelter,[],,"The OSM tags (highway=bus_stop, amenity=shelter, public_transport=platform) indicate this is a bus s"
1420101752,,Napoli,,restaurant,,,,,,,,POINT (10.328420639038086 52.153648376464844),Napoli. Amenity: restaurant.,1420101752,Restaurant ‘Napoli’,"['leisure', 'work']",Restaurants_Gastronomie,The OSM tag amenity=restaurant and name ‘Napoli’ clearly indicates an indoor dining establishment. F
1748352545,,Friseursalon Mosig,,,,hairdresser,,,,wheelchair no,,POINT (10.486004829406738 52.1630859375),Friseursalon Mosig. Shop: hairdresser. Additional tags: wheelchair no.,1748352545,hairdresser salon,"['leisure', 'work']",Publikumsorientierte_Dienstleistungen,The OSM tag shop=hairdresser and the name “Friseursalon” identify this as a hairdresser salon where 
353855210,,,,vending_machine,,,,,,payment coins yes vending condoms,,POINT (10.760167121887207 52.50074768066406),Amenity: vending_machine. Additional tags: payment coins yes vending condoms.,353855210,Condom vending machine,[],,"This POI is a standalone vending_machine offering condoms, i.e. an outdoor object/infrastructure rat"
1493115451,,,,toilets,,,,,,check date 2025 10 02 check date wheelchair 2025 10 02 fee no wheelchair limited,,POINT (10.41865062713623 51.69453811645508),Amenity: toilets. Additional tags: check date 2025 10 02 check date wheelchair 2025 10 02 fee no wheelchair limited.,1493115451,public toilet,[],,"The POI is tagged as amenity=toilets, indicating a public restroom facility. This is a non-building "
771607837,,,,parking,,,,,,capacity 9 fee yes,parking: surface,"POLYGON ((10.254721641540527 51.726932525634766, 10.254899978637695 51.72713088989258, 10.254992485046387 51.72710037231445, 10.254814147949219 51.72690200805664, 10.254762649536133 51.72692108154297, 10.254721641540527 51.726932525634766))",Amenity: parking. Additional tags: capacity 9 fee yes.,771607837,"Parking lot (9 spaces, paid)",[],,"The OSM tags indicate amenity=parking with capacity=9 and fee=yes, which describes a surface parking"
11290234666,,Meißners Wein & Delikatessen,,,,wine,,,,,,POINT (10.172809600830078 51.888816833496094),Meißners Wein & Delikatessen. Shop: wine.,11290234666,Wine and delicatessen shop,"['retail_non_daily', 'work']",Handel,The OSM tag “shop=wine” together with the name “Meißners Wein & Delikatessen” clearly indicates a re
2841519181,,,,bench,,,,,,backrest yes check date 2023 12 10 colour brown material wood,,POINT (10.540510177612305 52.2259407043457),Amenity: bench. Additional tags: backrest yes check date 2023 12 10 colour brown material wood.,2841519181,public bench,[],,"The OSM tags describe a freestanding bench (amenity=bench) made of wood with a backrest, last checke"
738961608,,Stadt Braunschweig,,parking,,,,,,access yes capacity 6 fee no operator type public surface paved,parking: surface,"POLYGON ((10.546273231506348 52.263492584228516, 10.546281814575195 52.26346969604492, 10.546728134155273 52.2635383605957, 10.546719551086426 52.26355743408203, 10.546273231506348 52.263492584228516))",Stadt Braunschweig. Amenity: parking. Additional tags: access yes capacity 6 fee no operator type public surface paved.,738961608,public parking lot,[],,"The POI is tagged as amenity=parking with outdoor attributes (capacity=6, surface=paved) and no buil"
