id,email,name,website,amenity,building,shop,tourism,information,addr:full,tags_search,additional_information,geometry,sentence,gml_id,interpreted_type,mid_labels,bosserhof_class,short_reason
1653092992,,Hammer,,,,doityourself,,,"Brandgehaege, 5B, Wolfsburg, 38444",addr suburb hattorf brand hammer brand wikidata q52159668 brand wikipedia de hammer fachmarktkette contact fax 49 5308 910861 contact phone 49 5308 9313330,,POINT (10.72781753540039 52.36859893798828),"Hammer. Shop: doityourself. Address: Brandgehaege, 5B, Wolfsburg, 38444. Additional tags: addr suburb hattorf brand hammer brand wikidata q52159668 brand wikipedia de hammer fachmarktkette contact fax 49 5308 910861 contact phone 49 5308 9313330.",1653092992,error,[],,"Failed: bosserhof_class must be a non-empty string, [] or None"
5599820606,,Golden Palast,http://www.goldenpalast.de/,restaurant,,,,,"Herzog-Wilhelm-Straße, 74, Bad Harzburg, 38667",cuisine chinese diet vegetarian yes outdoor seating yes smoking no toilets wheelchair no wheelchair yes,,POINT (10.559615135192871 51.87980270385742),"Golden Palast. Website: http://www.goldenpalast.de/. Amenity: restaurant. Address: Herzog-Wilhelm-Straße, 74, Bad Harzburg, 38667. Additional tags: cuisine chinese diet vegetarian yes outdoor seating yes smoking no toilets wheelchair no wheelchair yes.",5599820606,Chinese restaurant,"['leisure', 'work']",Restaurants_Gastronomie,The POI is tagged amenity=restaurant with cuisine=chinese and has a dedicated building at Herzog-Wil
533130265,,Beerencafe Alps,,parking,,,,,,access permissive capacity 50,,"POLYGON ((10.220958709716797 52.63324737548828, 10.220789909362793 52.6331901550293, 10.221012115478516 52.6326904296875, 10.221237182617188 52.63275146484375, 10.220958709716797 52.63324737548828))",Beerencafe Alps. Amenity: parking. Additional tags: access permissive capacity 50.,533130265,parking lot,[],,"The OSM tag amenity=parking with capacity=50 and access=permissive indicates this is a parking area,"
267018200,,,,parking,,,,,,,,POINT (10.355762481689453 51.66079330444336),Amenity: parking.,267018200,Parking lot,[],,"The OSM tag amenity=parking denotes an outdoor parking facility, which is infrastructure rather than"
3635123129,,Deutsche Post,,post_box,,,,,,brand deutsche post collection times mo sa 08 00 operator wikidata q157645,,POINT (10.832642555236816 52.13584518432617),Deutsche Post. Amenity: post_box. Additional tags: brand deutsche post collection times mo sa 08 00 operator wikidata q157645.,3635123129,Deutsche Post post box,[],,"The OSM tags (amenity=post_box, brand=Deutsche Post) indicate this is a standalone postal drop box, "
459931273,,,,,,,information,board,,board type nature,,POINT (10.795235633850098 52.30284118652344),Tourism: information; Information: board. Additional tags: board type nature.,459931273,Nature information board,[],,"The OSM tags tourism=information, information=board, and board:type=nature indicate an outdoor infor"
5232277842,,brillen.de,,,,optician,,,,brand brillen de brand wikidata q105275794 wheelchair yes,,POINT (10.520776748657227 52.26422882080078),brillen.de. Shop: optician. Additional tags: brand brillen de brand wikidata q105275794 wheelchair yes.,5232277842,Optician shop (glasses retailer),"['retail_non_daily', 'work']",Handel,The OSM tag shop=optician and name “brillen.de” indicate a retail outlet selling eyeglasses. As an e
4940067975,,,,bicycle_parking,,,,,,capacity 13 covered no,bicycle_parking: stands,POINT (10.716408729553223 52.423988342285156),Amenity: bicycle_parking. Additional tags: capacity 13 covered no.,4940067975,bicycle parking area,[],,"This POI is tagged amenity=bicycle_parking with capacity=13 and covered=no, indicating an outdoor bi"
864636673,,Catharina Neufang,https://grube-samson.de/museen/catharina-neufang,,,,museum,,,disused yes fee yes man made adit service times mo fr 13 45 dec 24 off jan 1 off wheelchair limited wikidata q21821385,,POINT (10.514923095703125 51.71371078491211),Catharina Neufang. Website: https://grube-samson.de/museen/catharina-neufang. Tourism: museum. Additional tags: disused yes fee yes man made adit service times mo fr 13 45 dec 24 off jan 1 off wheelchair limited wikidata q21821385.,864636673,Catharina Neufang mine museum (former adit museum),['leisure'],Entertainment_Kultur,The OSM tag tourism=museum and the site’s description as part of the Grube Samson mining museums ind
11711538218,,,,bench,,,,,,backrest yes material wood,,POINT (10.439057350158691 51.8072509765625),Amenity: bench. Additional tags: backrest yes material wood.,11711538218,bench,[],,The feature is a bench (amenity=bench) with backrest and wood material. This is an outdoor street fu
2316119314,,Bosse,,,,funeral_directors,,,"Bergstraße, 14, Gifhorn, 38518",check date 2024 07 11,,POINT (10.546905517578125 52.478694915771484),"Bosse. Shop: funeral_directors. Address: Bergstraße, 14, Gifhorn, 38518. Additional tags: check date 2024 07 11.",2316119314,Funeral director's office,"['errands_essential', 'work']",Publikumsorientierte_Dienstleistungen,The OSM tag shop=funeral_directors indicates an enterable building where funeral planning and relate
54239137,,,,school,,,,,,wheelchair yes,,"POLYGON ((10.262972831726074 51.711212158203125, 10.262981414794922 51.7095947265625, 10.266448974609375 51.70947265625, 10.267620086669922 51.71027755737305, 10.266655921936035 51.7108268737793, 10.265857696533203 51.711368560791016, 10.265769958496094 51.71144485473633, 10.26507568359375 51.712032318115234, 10.264472007751465 51.71253967285156, 10.26327896118164 51.712284088134766, 10.262946128845215 51.71221160888672, 10.262972831726074 51.711212158203125))",Amenity: school. Additional tags: wheelchair yes.,54239137,School,"['education_school', 'work']",Schulen,"The OSM tag amenity=school indicates this place is a school building. Under MiD 2023 purposes, trips"
7731069090,,Lukas-Werk Fachambulanz,https://www.neuerkerode.de/gesundheitsdienste/angebote/behandlungsangebote/ambulante-rehabilitation/fachambulanz-peine/,social_facility,,,,,"Bahnhofstraße, 8, Peine, 31226",operator short esn operator wikidata q1381175 social facility for drug addicted,social_facility: day_care,POINT (10.2307710647583 52.31800842285156),"Lukas-Werk Fachambulanz. Website: https://www.neuerkerode.de/gesundheitsdienste/angebote/behandlungsangebote/ambulante-rehabilitation/fachambulanz-peine/. Amenity: social_facility. Address: Bahnhofstraße, 8, Peine, 31226. Additional tags: operator short esn operator wikidata q1381175 social facility for drug addicted.",7731069090,Outpatient rehabilitation clinic for drug addiction,"['errands_essential', 'work']",Publikumsorientierte_Dienstleistungen,Lukas-Werk Fachambulanz is tagged amenity=social_facility and described as an outpatient rehabilitat
11013485866,,,,bicycle_parking,,,,,,capacity 20 covered no,bicycle_parking: stands,POINT (10.784943580627441 52.41928482055664),Amenity: bicycle_parking. Additional tags: capacity 20 covered no.,11013485866,Outdoor bicycle parking facility,[],,"The OSM tag amenity=bicycle_parking denotes an outdoor bicycle parking area, which is infrastructure"
6926922161,,,,waste_basket,,,,,,check date 2026 01 09,,POINT (10.553110122680664 52.26430892944336),Amenity: waste_basket. Additional tags: check date 2026 01 09.,6926922161,public waste basket,[],,"The OSM tag amenity=waste_basket denotes a standalone waste bin, which is an outdoor fixture rather "
703897804,,,,bench,,,,,,backrest yes,,POINT (10.25235652923584 52.56110382080078),Amenity: bench. Additional tags: backrest yes.,703897804,public bench with backrest,[],,"The POI is an outdoor bench (amenity=bench, backrest=yes), which is not an enterable building or fac"
192986187,,,,parking,,,,,,,parking: surface,"POLYGON ((10.009804725646973 51.66325759887695, 10.009783744812012 51.663597106933594, 10.009427070617676 51.66356658935547, 10.009317398071289 51.6633186340332, 10.009804725646973 51.66325759887695))",Amenity: parking.,192986187,Parking lot,[],,"The OSM tag amenity=parking refers to an outdoor parking facility for vehicles, which is not an ente"
1600044141,,Kartoffeln und Eier,,,,farm,,,,,,POINT (10.629865646362305 52.5118522644043),Kartoffeln und Eier. Shop: farm.,1600044141,Farm shop selling potatoes and eggs,"['errands_essential', 'work']",Handel,The snippet describes a shop on a farm selling potatoes and eggs (shop=farm). Visitors go there to p
7539020581,,,,bench,,,,,,,,POINT (10.56949520111084 52.060089111328125),Amenity: bench.,7539020581,Bench,[],,"The feature is tagged amenity=bench, indicating an outdoor seating object. It is not an enterable bu"
37400048,,,,parking,,,,,,access permissive capacity 4 wheelchair yes,,"POLYGON ((10.065207481384277 52.13361358642578, 10.065136909484863 52.13361358642578, 10.065135955810547 52.13371276855469, 10.065135955810547 52.13373565673828, 10.065207481384277 52.13373565673828, 10.065207481384277 52.13361358642578))",Amenity: parking. Additional tags: access permissive capacity 4 wheelchair yes.,37400048,parking lot,[],,The OSM tag amenity=parking indicates an open parking area for vehicles. There is no enterable build
492675294,,Steuerberater Curland&Partner,,tax_agent,,,,,"An der Wabe, 7, Sickte, 38173",,,POINT (10.634343147277832 52.21253967285156),"Steuerberater Curland&Partner. Amenity: tax_agent. Address: An der Wabe, 7, Sickte, 38173.",492675294,error,[],,Failed: Invalid MiD label: erledigungen_essential
291627099,,Globus Baumarkt,,,retail,doityourself,,,"Carl-Zeiß-Straße, 7, Goslar, 38644",addr suburb baßgeige brand globus baumarkt brand wikidata q457503 brand wikipedia de globus holding check date 2025 07 17 check date opening hours 2025 07 17 contact email infozentrum bfm goslar globus baumarkt de contact fax 49 5321 683 28 444 contact phone 49 5321 683 28 0 contact website https globus baumarkt de info markt goslar wheelchair yes,internet_access: wlan,"POLYGON ((10.410078048706055 51.93367004394531, 10.41114330291748 51.93365478515625, 10.411140441894531 51.93359375, 10.411518096923828 51.93358612060547, 10.411484718322754 51.93278121948242, 10.411527633666992 51.93278121948242, 10.411514282226562 51.93244552612305, 10.41025447845459 51.932464599609375, 10.410257339477539 51.932525634765625, 10.410030364990234 51.93252944946289, 10.410078048706055 51.93367004394531))","Globus Baumarkt. Building: retail; Shop: doityourself. Address: Carl-Zeiß-Straße, 7, Goslar, 38644. Additional tags: addr suburb baßgeige brand globus baumarkt brand wikidata q457503 brand wikipedia de globus holding check date 2025 07 17 check date opening hours 2025 07 17 contact email infozentrum bfm goslar globus baumarkt de contact fax 49 5321 683 28 444 contact phone 49 5321 683 28 0 contact website https globus baumarkt de info markt goslar wheelchair yes.",291627099,Globus Baumarkt DIY/home improvement store,"['retail_non_daily', 'work']",Einzelhandel_grossflaechig_Baumaerkte,"This POI is tagged building=retail and shop=doityourself, indicating a large-format DIY/home improve"
177798757,,,,toilets,toilets,,,,"Nordhäuser Straße, 12A",access yes check date 2025 07 28 fee no roof shape flat toilets disposal flush toilets handwashing yes toilets position seated urinal unisex yes wheelchair yes,,"POLYGON ((10.557419776916504 51.867305755615234, 10.557435035705566 51.86730194091797, 10.557500839233398 51.86729049682617, 10.557477951049805 51.86723709106445, 10.55739688873291 51.86724853515625, 10.557419776916504 51.867305755615234))","Amenity: toilets; Building: toilets. Address: Nordhäuser Straße, 12A. Additional tags: access yes check date 2025 07 28 fee no roof shape flat toilets disposal flush toilets handwashing yes toilets position seated urinal unisex yes wheelchair yes.",177798757,Public toilet building,['errands_essential'],,The OSM tags (amenity=toilets; building=toilets) indicate this is a small public restroom facility. 
164927441,,VW Motorradparkplatz,,motorcycle_parking,,,,,,capacity 84 covered no fee no layer 0,parking: surface,"POLYGON ((10.741659164428711 52.43631362915039, 10.743112564086914 52.43645095825195, 10.743119239807129 52.43642807006836, 10.74166488647461 52.4362907409668, 10.741659164428711 52.43631362915039))",VW Motorradparkplatz. Amenity: motorcycle_parking. Additional tags: capacity 84 covered no fee no layer 0.,164927441,motorcycle parking lot,[],,The POI is tagged amenity=motorcycle_parking with no building tag and describes an outdoor parking f
11308717171,,,,bench,,,,,,access yes backrest no material wood,,POINT (10.519740104675293 52.2624397277832),Amenity: bench. Additional tags: access yes backrest no material wood.,11308717171,public bench,[],,"The feature is an OSM amenity=bench (material=wood, backrest=no), which is outdoor furniture and not"
1462670347,,,,parking_space,,,,,,,,"POLYGON ((10.580782890319824 52.284400939941406, 10.580743789672852 52.28439712524414, 10.580730438232422 52.2844352722168, 10.580769538879395 52.28444290161133, 10.580782890319824 52.284400939941406))",Amenity: parking_space.,1462670347,Parking space,[],,The OSM tag “amenity=parking_space” refers to an outdoor parking spot or area rather than an enterab
348028054,,Grillhütte,,shelter,yes,,,,,bin yes fee 15 shelter type picnic shelter,,"POLYGON ((11.001007080078125 52.206790924072266, 11.001007080078125 52.20681381225586, 11.000983238220215 52.20682907104492, 11.000945091247559 52.20682907104492, 11.0009183883667 52.20681381225586, 11.000920295715332 52.206790924072266, 11.000945091247559 52.2067756652832, 11.000981330871582 52.2067756652832, 11.001007080078125 52.206790924072266))",Grillhütte. Amenity: shelter; Building: yes. Additional tags: bin yes fee 15 shelter type picnic shelter.,348028054,picnic shelter (Grillhütte),['leisure'],Kultur_Freizeit_Sport,"The feature is tagged amenity=shelter, building=yes, shelter_type=picnic_shelter with a fee, indicat"
319781929,,,,parking,,,,,,access customers,parking: surface,"POLYGON ((10.022415161132812 52.6019172668457, 10.02259635925293 52.60198974609375, 10.02265453338623 52.60193634033203, 10.022706985473633 52.60188674926758, 10.022525787353516 52.60181427001953, 10.022415161132812 52.6019172668457))",Amenity: parking. Additional tags: access customers.,319781929,Customer parking lot,[],,The OSM tags (amenity=parking; access=customers) describe an outdoor parking area reserved for custo
1452627528,,,,parking_space,,,,,,,,"POLYGON ((10.518538475036621 52.28558349609375, 10.518573760986328 52.28558349609375, 10.518573760986328 52.28562927246094, 10.518537521362305 52.28562927246094, 10.518538475036621 52.28558349609375))",Amenity: parking_space.,1452627528,parking space,[],,"The OSM tag 'amenity=parking_space' denotes an individual parking spot, which is an outdoor infrastr"
185287561,,,,place_of_worship,yes,,,,,seamark landmark category tower seamark landmark conspicuity conspicuous seamark source wsv seamark type landmark,religion: christian,"POLYGON ((10.21074104309082 52.293609619140625, 10.210742950439453 52.29356002807617, 10.210912704467773 52.29356384277344, 10.21091365814209 52.29352951049805, 10.211018562316895 52.29353332519531, 10.211016654968262 52.2935676574707, 10.211060523986816 52.2935676574707, 10.2110595703125 52.293617248535156, 10.211016654968262 52.293617248535156, 10.211015701293945 52.293643951416016, 10.210906028747559 52.293643951416016, 10.210906982421875 52.29361343383789, 10.21074104309082 52.293609619140625))",Amenity: place_of_worship; Building: yes. Additional tags: seamark landmark category tower seamark landmark conspicuity conspicuous seamark source wsv seamark type landmark.,185287561,Place of worship (church building/tower),"['leisure', 'work']",,"The OSM tags amenity=place_of_worship and building=yes indicate an enterable religious building, lik"
195988419,,,,parking,,,,,,access yes fee no,parking: surface,"POLYGON ((10.090239524841309 52.62791442871094, 10.09099006652832 52.62783432006836, 10.090984344482422 52.62781524658203, 10.090192794799805 52.62789535522461, 10.090239524841309 52.62791442871094))",Amenity: parking. Additional tags: access yes fee no.,195988419,Parking lot,[],,"The OSM tag amenity=parking indicates an outdoor parking facility, which is not an enterable buildin"
342964225,,,,parking,,,,,,access private,parking: surface,"POLYGON ((10.561433792114258 52.314048767089844, 10.561504364013672 52.31404113769531, 10.561455726623535 52.31373977661133, 10.561386108398438 52.313743591308594, 10.561433792114258 52.314048767089844))",Amenity: parking. Additional tags: access private.,342964225,Private parking lot,[],,"The OSM tags describe an amenity=parking with access=private, indicating a parking lot, which is an "
3111694193,,,,,,,information,map,,,,POINT (10.648250579833984 51.89448165893555),Tourism: information; Information: map.,3111694193,Tourist information map stand,[],,The OSM tags tourism=information and information=map indicate an outdoor tourist map display or info
1746830745,,Pfauenbrunnen,,fountain,,,,,,,,POINT (10.789949417114258 52.427059173583984),Pfauenbrunnen. Amenity: fountain.,1746830745,Pfauenbrunnen fountain,[],,The OSM tag amenity=fountain indicates an outdoor water feature. It is not an enterable building or 
403460907,,,,parking_space,,,,,,,,"POLYGON ((10.538201332092285 52.46145248413086, 10.538166046142578 52.461448669433594, 10.538148880004883 52.461490631103516, 10.538185119628906 52.46149826049805, 10.538201332092285 52.46145248413086))",Amenity: parking_space.,403460907,parking space,[],,"The OSM tag amenity=parking_space refers to an outdoor vehicle parking spot, which is not an enterab"
594907121,,,,shelter,,,,,,bench yes bin yes shelter type public transport,,"POLYGON ((10.51894474029541 52.283451080322266, 10.518962860107422 52.283451080322266, 10.518945693969727 52.28339767456055, 10.518928527832031 52.28339767456055, 10.51894474029541 52.283451080322266))",Amenity: shelter. Additional tags: bench yes bin yes shelter type public transport.,594907121,Public transport shelter,[],,"The OSM tags (amenity=shelter, shelter_type=public_transport, bench=yes, bin=yes) describe a waiting"
7812333359,,,,fire_station,,,,,,,,POINT (10.97343921661377 52.412132263183594),Amenity: fire_station.,7812333359,Fire station,['work'],Dienstleistung,The OSM tag amenity=fire_station indicates an enterable building where professional staff (firefight
1208738870,,,,bicycle_parking,,,,,,capacity 12 covered no,bicycle_parking: stands,"POLYGON ((10.52810287475586 52.265625, 10.5281343460083 52.26559066772461, 10.528056144714355 52.26557922363281, 10.52802562713623 52.26561737060547, 10.52810287475586 52.265625))",Amenity: bicycle_parking. Additional tags: capacity 12 covered no.,1208738870,bicycle parking (outdoor rack),[],,The OSM tags indicate an amenity=bicycle_parking with no shelter (covered=no) and capacity=12. This 
366870794,,Deutsche Post,,post_box,,,,,,collection times mo sa 08 00 operator wikidata q157645,,POINT (10.812576293945312 52.26092529296875),Deutsche Post. Amenity: post_box. Additional tags: collection times mo sa 08 00 operator wikidata q157645.,366870794,Deutsche Post collection box (post box),[],,"The OSM tags indicate amenity=post_box, which is an outdoor postal drop-off box that people do not e"
3085842533,,INFRa - intake fan rig,,university,,,,,,check date 2025 09 14,,POINT (10.543707847595215 52.31364440917969),INFRa - intake fan rig. Amenity: university. Additional tags: check date 2025 09 14.,3085842533,University intake fan rig (infrastructure equipment),[],,The POI is an intake fan rig—an infrastructure/equipment installation—rather than an enterable build
9359193937,,,,bench,,,,,,,,POINT (10.840323448181152 52.440528869628906),Amenity: bench.,9359193937,bench,[],,The OSM tag amenity=bench denotes a standalone outdoor seat. This is not an enterable building or fa
378131666,,,,parking,,,,,,access private orientation perpendicular surface paving stones,parking: street_side,"POLYGON ((10.629854202270508 52.5086669921875, 10.629514694213867 52.508628845214844, 10.629528999328613 52.508583068847656, 10.629867553710938 52.50862121582031, 10.629854202270508 52.5086669921875))",Amenity: parking. Additional tags: access private orientation perpendicular surface paving stones.,378131666,surface parking lot (private),[],,"The OSM tags indicate amenity=parking with surface=paving_stones and orientation=perpendicular, whic"
417647525,,Tafel 2,https://www.dollbergen.de/dorferlebnispfad/tafel-02/,,,,information,board,,board type history check date 2023 05 16 description dorferlebnispfad dollbergen,,POINT (10.182304382324219 52.4079475402832),Tafel 2. Website: https://www.dollbergen.de/dorferlebnispfad/tafel-02/. Tourism: information; Information: board. Additional tags: board type history check date 2023 05 16 description dorferlebnispfad dollbergen.,417647525,Information board (outdoor trail sign),[],,The POI is an outdoor information board (‘Tafel 2’) on the Dorferlebnispfad in Dollbergen. It is not
605943150,,,,parking_space,,,,,,,,"POLYGON ((10.363426208496094 51.79753494262695, 10.363390922546387 51.79754638671875, 10.363421440124512 51.79758834838867, 10.363456726074219 51.79758071899414, 10.363426208496094 51.79753494262695))",Amenity: parking_space.,605943150,Parking space,[],,"The OSM tag amenity=parking_space indicates an outdoor parking stall, which is not an enterable buil"
3630426594,,,,bench,,,,,,,,POINT (10.923027038574219 52.426429748535156),Amenity: bench.,3630426594,bench,[],,The OSM tag amenity=bench indicates a standalone outdoor seating object. It is not an enterable buil
887649179,,,,parking,,,,,,,,"POLYGON ((10.535738945007324 51.8940544128418, 10.535459518432617 51.894142150878906, 10.53549861907959 51.894187927246094, 10.535778045654297 51.894100189208984, 10.535738945007324 51.8940544128418))",Amenity: parking.,887649179,Parking lot,[],,"The OSM tag amenity=parking indicates a parking area or lot, which is an open transport-related infr"
9370516964,,Aus der Geschichte,,,,,information,board,,board type history description chronik des ortes wohlde,,POINT (9.99966049194336 52.81442642211914),Aus der Geschichte. Tourism: information; Information: board. Additional tags: board type history description chronik des ortes wohlde.,9370516964,Historical information board,[],,The POI is a tourism=information board with type=history providing a local chronicle (‘chronik des o
80261108,,,,parking,,,,,,wheelchair yes,,"POLYGON ((10.011210441589355 52.07326126098633, 10.011526107788086 52.07325744628906, 10.011483192443848 52.073360443115234, 10.01192855834961 52.07341384887695, 10.012042045593262 52.07341384887695, 10.012125968933105 52.07323455810547, 10.012075424194336 52.07307052612305, 10.01164436340332 52.073001861572266, 10.011194229125977 52.072994232177734, 10.011210441589355 52.07326126098633))",Amenity: parking. Additional tags: wheelchair yes.,80261108,parking lot,[],,"The OSM tag amenity=parking denotes an outdoor parking facility, not an enterable building. It is in"
3240680286,,Apotheke im Gesundheitszentrum Ilsede,https://meine-landapotheken.de/,pharmacy,,,,,"Eichstraße, 5, Ilsede, 31241",addr suburb groß ilsede healthcare pharmacy wheelchair limited,,POINT (10.218369483947754 52.263919830322266),"Apotheke im Gesundheitszentrum Ilsede. Website: https://meine-landapotheken.de/. Amenity: pharmacy. Address: Eichstraße, 5, Ilsede, 31241. Additional tags: addr suburb groß ilsede healthcare pharmacy wheelchair limited.",3240680286,pharmacy in a health center,"['errands_essential', 'work']",Publikumsorientierte_Dienstleistungen,The OSM tag amenity=pharmacy and the name ‘Apotheke im Gesundheitszentrum Ilsede’ indicate this is a
331102488,,China wok / Lynn's Tea,,restaurant,,,,,"Schloßstraße, 15, Burgdorf, 31303",check date 2025 10 28 cuisine chinese bubble tea,,POINT (10.01035213470459 52.44609832763672),"China wok / Lynn's Tea. Amenity: restaurant. Address: Schloßstraße, 15, Burgdorf, 31303. Additional tags: check date 2025 10 28 cuisine chinese bubble tea.",331102488,Chinese restaurant and bubble tea shop,"['leisure', 'work']",Restaurants_Gastronomie,The OSM tag amenity=restaurant with cuisine=chinese and bubble tea indicates an enterable dining est
12949725573,,,,,,,information,guidepost,,direction east gliesmarode 3 4 querum 2 1 km direction north wenden 5 3 km kralenriede 0 9 km direction west rühme 2 5 km vorwerksiedlung 1 6 km survey date 2025 06 24,bicycle: yes,POINT (10.540761947631836 52.29561996459961),Tourism: information; Information: guidepost. Additional tags: direction east gliesmarode 3 4 querum 2 1 km direction north wenden 5 3 km kralenriede 0 9 km direction west rühme 2 5 km vorwerksiedlung 1 6 km survey date 2025 06 24.,12949725573,tourist information guidepost,[],,The OSM tags indicate this is a ‘tourism=information’ guidepost with directional sign arrows (e.g. d
585510910,,,,parking,,,,,,fee no,,"POLYGON ((10.480981826782227 52.232574462890625, 10.480914115905762 52.232547760009766, 10.480806350708008 52.23134994506836, 10.480874061584473 52.23131561279297, 10.480981826782227 52.232574462890625))",Amenity: parking. Additional tags: fee no.,585510910,parking lot,[],,"The OSM tag amenity=parking with fee=no indicates an outdoor parking area, not an enterable building"
11251410836,,Salon Lehmann,,,,hairdresser,,,"Rosenstraße, 9, Vechelde, 38159",,,POINT (10.413093566894531 52.25685501098633),"Salon Lehmann. Shop: hairdresser. Address: Rosenstraße, 9, Vechelde, 38159.",11251410836,Hair salon (hairdresser),"['leisure', 'work']",Publikumsorientierte_Dienstleistungen,The OSM tag “shop=hairdresser” and the name “Salon Lehmann” clearly identify this as an enterable ha
